{
  "contract": "pocketfinancer.persistence-policy/2",
  "predecessor": "pocketfinancer.persistence-policy/1",
  "default_rollout_mode": "automatic",
  "automatic_persistence_enabled": true,
  "complete_posted_destination": "transactions",
  "exception_destination": "review",
  "duplicate_destination": "review",
  "valid_none_destination": "no_transaction",
  "valid_none_review_case_created": false,
  "transaction_write": "atomic_with_operation_settlement",
  "stored_operation_release_behavior": "original_release",
  "retry_behavior": "new_operation_with_parent_operation_id",
  "review_contract": "pocketfinancer.review-case/2",
  "processing_result_contract": "pocketfinancer.processing-result/3",
  "source_retention": "host_privacy_policy",
  "requires_unique_existing_account": true,
  "requires_clear_duplicate_assessment": true,
  "allows_automatic_account_creation": false,
  "allows_default_account_fallback": false
}
